{
  "diagnostics": [],
  "kind": "lean-bridge-elaborated-exports",
  "modules": [
    {
      "declarations": [
        {
          "documentation": null,
          "effects": [],
          "identity": "RecursiveCheckedRecords.Groups",
          "kind": "abbreviation",
          "parameters": [],
          "projection": {
            "expression": "Type",
            "reason": "type-declaration",
            "status": "unsupported"
          },
          "resultExpression": "Type",
          "selected": false,
          "source": {
            "endColumn": 43,
            "endLine": 32,
            "path": "RecursiveCheckedRecords.lean",
            "startColumn": 0,
            "startLine": 32
          },
          "theoremReferences": [],
          "typeExpression": "Type",
          "visibility": "public"
        },
        {
          "documentation": null,
          "effects": [],
          "identity": "RecursiveCheckedRecords.PacketAlias",
          "kind": "abbreviation",
          "parameters": [],
          "projection": {
            "expression": "Type",
            "reason": "type-declaration",
            "status": "unsupported"
          },
          "resultExpression": "Type",
          "selected": false,
          "source": {
            "endColumn": 28,
            "endLine": 31,
            "path": "RecursiveCheckedRecords.lean",
            "startColumn": 0,
            "startLine": 31
          },
          "theoremReferences": [],
          "typeExpression": "Type",
          "visibility": "public"
        },
        {
          "documentation": "A positive word represented by its natural-number payload. ",
          "effects": [],
          "identity": "RecursiveCheckedRecords.Positive",
          "kind": "abbreviation",
          "parameters": [],
          "projection": {
            "expression": "Type",
            "reason": "type-declaration",
            "status": "unsupported"
          },
          "resultExpression": "Type",
          "selected": false,
          "source": {
            "endColumn": 47,
            "endLine": 4,
            "path": "RecursiveCheckedRecords.lean",
            "startColumn": 0,
            "startLine": 3
          },
          "theoremReferences": [
            "RecursiveCheckedRecords.Packet.mk.inj",
            "RecursiveCheckedRecords.Packet.mk.injEq",
            "RecursiveCheckedRecords.Packet.mk.sizeOf_spec",
            "RecursiveCheckedRecords.positive.eq_1"
          ],
          "typeExpression": "Type",
          "visibility": "public"
        },
        {
          "documentation": null,
          "effects": [],
          "identity": "RecursiveCheckedRecords.echo",
          "kind": "definition",
          "parameters": [
            {
              "binderInfo": "explicit",
              "name": "value",
              "typeExpression": "RecursiveCheckedRecords.Packet"
            }
          ],
          "projection": {
            "bindingShape": "native-function",
            "parameters": [
              {
                "name": "value",
                "type": {
                  "abi": {
                    "box": "lean_box",
                    "cType": "lean_object*",
                    "heap": true,
                    "unbox": "lean_unbox"
                  },
                  "kind": "graph",
                  "root": {
                    "abi": {
                      "box": "lean_box",
                      "cType": "lean_object*",
                      "heap": true,
                      "unbox": "lean_unbox"
                    },
                    "base": {
                      "abi": {
                        "box": "lean_box",
                        "cType": "lean_object*",
                        "heap": true,
                        "unbox": "lean_unbox"
                      },
                      "kind": "reference",
                      "lean": "RecursiveCheckedRecords.Packet",
                      "name": "RecursiveCheckedRecords.Packet"
                    },
                    "kind": "refinement",
                    "predicate": {
                      "constructor": "RecursiveCheckedRecords.mkPacket",
                      "kind": "checked-record"
                    }
                  },
                  "types": [
                    {
                      "abi": {
                        "box": "lean_box",
                        "cType": "lean_object*",
                        "heap": true,
                        "unbox": "lean_unbox"
                      },
                      "constructor": "RecursiveCheckedRecords.Packet.mk",
                      "erased": [
                        "linked"
                      ],
                      "fields": [
                        {
                          "name": "value",
                          "projection": "RecursiveCheckedRecords.Packet.value",
                          "type": {
                            "abi": {
                              "box": "lean_box",
                              "cType": "lean_object*",
                              "heap": false,
                              "unbox": "lean_unbox"
                            },
                            "base": {
                              "abi": {
                                "box": "lean_box",
                                "cType": "lean_object*",
                                "heap": false,
                                "unbox": "lean_unbox"
                              },
                              "kind": "primitive",
                              "lean": "Nat",
                              "name": "nat"
                            },
                            "kind": "refinement",
                            "predicate": {
                              "constructor": "RecursiveCheckedRecords.plusOne",
                              "kind": "subtype"
                            }
                          }
                        },
                        {
                          "name": "digit",
                          "projection": "RecursiveCheckedRecords.Packet.digit",
                          "type": {
                            "abi": {
                              "box": "lean_box",
                              "cType": "lean_object*",
                              "heap": false,
                              "unbox": "lean_unbox"
                            },
                            "base": {
                              "abi": {
                                "box": "lean_box",
                                "cType": "lean_object*",
                                "heap": false,
                                "unbox": "lean_unbox"
                              },
                              "kind": "primitive",
                              "lean": "Nat",
                              "name": "nat"
                            },
                            "kind": "refinement",
                            "predicate": {
                              "bound": "3",
                              "kind": "fin"
                            }
                          }
                        },
                        {
                          "name": "tail",
                          "projection": "RecursiveCheckedRecords.Packet.tail",
                          "type": {
                            "abi": {
                              "box": "lean_box",
                              "cType": "lean_object*",
                              "heap": false,
                              "unbox": "lean_unbox"
                            },
                            "element": {
                              "abi": {
                                "box": "lean_box",
                                "cType": "lean_object*",
                                "heap": true,
                                "unbox": "lean_unbox"
                              },
                              "kind": "reference",
                              "lean": "RecursiveCheckedRecords.Packet",
                              "name": "RecursiveCheckedRecords.Packet"
                            },
                            "kind": "option"
                          }
                        }
                      ],
                      "kind": "record",
                      "lean": "RecursiveCheckedRecords.Packet",
                      "name": "RecursiveCheckedRecords.Packet"
                    }
                  ]
                }
              }
            ],
            "result": {
              "abi": {
                "box": "lean_box",
                "cType": "lean_object*",
                "heap": true,
                "unbox": "lean_unbox"
              },
              "kind": "graph",
              "root": {
                "abi": {
                  "box": "lean_box",
                  "cType": "lean_object*",
                  "heap": true,
                  "unbox": "lean_unbox"
                },
                "kind": "reference",
                "lean": "RecursiveCheckedRecords.Packet",
                "name": "RecursiveCheckedRecords.Packet"
              },
              "types": [
                {
                  "abi": {
                    "box": "lean_box",
                    "cType": "lean_object*",
                    "heap": true,
                    "unbox": "lean_unbox"
                  },
                  "constructor": "RecursiveCheckedRecords.Packet.mk",
                  "erased": [
                    "linked"
                  ],
                  "fields": [
                    {
                      "name": "value",
                      "projection": "RecursiveCheckedRecords.Packet.value",
                      "type": {
                        "abi": {
                          "box": "lean_box",
                          "cType": "lean_object*",